{
  "$schema": "https://offramp.dev/schemas/v1/envelope.json",
  "offramp": {
    "version": "{Version}",
    "command": "newtonsoft tests",
    "target": "net10.0",
    "repositoryRoot": "{RepositoryRoot}",
    "solution": "NewtonsoftLegacy.sln",
    "workspaceHash": "sha256:{Hash}",
    "startedAt": "{StartedAt}",
    "durationMs": 0,
    "effectiveConfig": {
      "deadCode": {
        "externalConsumers": []
      },
      "deps": {
        "cpm": {
          "file": "Directory.Packages.props",
          "scope": "solution"
        },
        "families": [],
        "feeds": null,
        "ignore": [],
        "includePrerelease": false,
        "packageMap": [],
        "pins": [],
        "preferNewest": false,
        "redirects": {
          "manage": []
        }
      },
      "ide": {
        "implicitCounterparts": true,
        "newCode": {
          "base": "auto",
          "scope": "lines"
        }
      },
      "llm": {
        "apiKeyEnv": "OFFRAMP_LLM_API_KEY",
        "enabled": false,
        "model": null,
        "provider": "openai",
        "url": "http://localhost:1234/v1",
        "uses": [
          "naming",
          "ranking"
        ]
      },
      "move": {
        "coMove": "closure",
        "namespaceMismatch": "allow",
        "suppressAnalyzers": [
          "IDE0130"
        ],
        "tests": {
          "frameworks": [
            "xunit",
            "nunit",
            "mstest",
            "tunit"
          ],
          "helperMinConfidence": "high",
          "stripTestsSegment": true,
          "targetSuffix": ".Tests"
        },
        "verify": "end"
      },
      "newtonsoft": {
        "hermetic": {
          "nonHermetic": []
        },
        "onDiff": "keep",
        "samples": null,
        "scope": "deployed",
        "target": "[13.0,14.0)",
        "tests": {
          "command": null,
          "entryDepth": 4,
          "folder": "NewtonsoftCharacterization",
          "objectDepth": 3,
          "projects": {},
          "runs": 2,
          "samplesPerType": 3,
          "timeoutSeconds": 1800
        },
        "upgradeFloor": "13.0.1"
      },
      "paths": {
        "exclude": [],
        "state": ".offramp"
      },
      "projectMap": [],
      "projects": [],
      "report": {
        "ledger": ".offramp/ledger",
        "title": null
      },
      "rules": {
        "packs": {
          "disable": []
        }
      },
      "scan": {
        "builder": "dotnet",
        "msbuildPath": null
      },
      "seams": {
        "hostFramework": "auto",
        "unportableSources": [
          "audit"
        ],
        "unportableSymbols": []
      },
      "service": {
        "dockerfile": true,
        "healthEndpoint": true,
        "host": "linux",
        "k8s": false,
        "logging": "json-console"
      },
      "solution": null,
      "target": 10,
      "verify": {
        "builder": "inherit",
        "command": null,
        "configuration": "Debug",
        "mode": "build",
        "noWarn": [],
        "onFailure": "rollback",
        "projects": {
          "exclude": [],
          "include": []
        },
        "properties": {},
        "restore": true,
        "timeoutSeconds": 1800,
        "warnAsError": []
      },
      "version": 1
    }
  },
  "result": {
    "targets": [
      {
        "production": "src/Orders/Orders.csproj",
        "testProject": "tests/Orders.Tests/Orders.Tests.csproj",
        "framework": "mstest",
        "by": "reference",
        "folder": "tests/Orders.Tests/NewtonsoftCharacterization"
      }
    ],
    "probes": [],
    "uncovered": [],
    "files": [
      {
        "path": "tests/Orders.Tests/NewtonsoftCharacterization/OfframpObjectDump.cs",
        "action": "delete"
      },
      {
        "path": "tests/Orders.Tests/NewtonsoftCharacterization/OfframpProbe.cs",
        "action": "delete"
      },
      {
        "path": "tests/Orders.Tests/NewtonsoftCharacterization/OrdersDeserializeProbes.cs",
        "action": "delete"
      },
      {
        "path": "tests/Orders.Tests/NewtonsoftCharacterization/OrdersSerializeProbes.cs",
        "action": "delete"
      }
    ],
    "coverage": {
      "sites": 0,
      "withEntryProbe": 0,
      "withTypeProbe": 0,
      "uncovered": {}
    },
    "preview": "--- a/tests/Orders.Tests/Orders.Tests.csproj\n+++ b/tests/Orders.Tests/Orders.Tests.csproj\n@@ -50,10 +50,6 @@\n     <Reference Include=\"System.Xml\" />\n   </ItemGroup>\n   <ItemGroup>\n-    <Compile Include=\"NewtonsoftCharacterization\\OfframpObjectDump.cs\" />\n-    <Compile Include=\"NewtonsoftCharacterization\\OfframpProbe.cs\" />\n-    <Compile Include=\"NewtonsoftCharacterization\\OrdersDeserializeProbes.cs\" />\n-    <Compile Include=\"NewtonsoftCharacterization\\OrdersSerializeProbes.cs\" />\n     <Compile Include=\"OrderCodecTests.cs\" />\n     <Compile Include=\"Properties\\AssemblyInfo.cs\" />\n   </ItemGroup>\ndeleted file tests/Orders.Tests/NewtonsoftCharacterization/OfframpObjectDump.cs\ndeleted file tests/Orders.Tests/NewtonsoftCharacterization/OfframpProbe.cs\ndeleted file tests/Orders.Tests/NewtonsoftCharacterization/OrdersDeserializeProbes.cs\ndeleted file tests/Orders.Tests/NewtonsoftCharacterization/OrdersSerializeProbes.cs\n",
    "applied": false,
    "journal": null,
    "mode": "remove",
    "runs": [],
    "outcomes": [],
    "baselineJournal": null
  },
  "diagnostics": [
    {
      "code": "OFR0002",
      "severity": "warning",
      "message": "The workspace model is stale: 1 changed (tests/Orders.Tests/Orders.Tests.csproj). Run `offramp scan`.",
      "project": null,
      "file": null,
      "line": null,
      "column": null,
      "data": {
        "added": [],
        "changed": [
          "tests/Orders.Tests/Orders.Tests.csproj"
        ],
        "removed": [],
        "sourceChanged": false
      },
      "help": "https://offramp.dev/diagnostics/OFR0002"
    },
    {
      "code": "OFR0016",
      "severity": "info",
      "message": "No offramp.yml at the repository root; built-in defaults are in effect. Run `offramp init` to create one.",
      "project": null,
      "file": null,
      "line": null,
      "column": null,
      "data": {},
      "help": "https://offramp.dev/diagnostics/OFR0016"
    }
  ],
  "summary": {
    "errors": 0,
    "warnings": 1,
    "info": 1
  }
}
