{
  "$schema": "https://offramp.dev/schemas/v1/envelope.json",
  "offramp": {
    "version": "0.1.0",
    "command": "doctor",
    "target": "net10.0",
    "repositoryRoot": "/abs/repo",
    "solution": "src/Monolith.sln",
    "workspaceHash": null,
    "startedAt": "2026-09-25T20:11:04Z",
    "durationMs": 1234,
    "effectiveConfig": {
      "deadCode": {
        "externalConsumers": []
      },
      "deps": {
        "cpm": {
          "file": "Directory.Packages.props",
          "scope": "solution"
        },
        "families": [],
        "feeds": null,
        "ignore": [],
        "includePrerelease": false,
        "packageMap": [],
        "pins": [],
        "preferNewest": false,
        "redirects": {
          "manage": []
        }
      },
      "ide": {
        "implicitCounterparts": true,
        "newCode": {
          "base": "auto",
          "scope": "lines"
        }
      },
      "llm": {
        "apiKeyEnv": "OFFRAMP_LLM_API_KEY",
        "enabled": false,
        "model": null,
        "provider": "openai",
        "url": "http://localhost:1234/v1",
        "uses": [
          "naming",
          "ranking"
        ]
      },
      "move": {
        "coMove": "closure",
        "namespaceMismatch": "allow",
        "suppressAnalyzers": [
          "IDE0130"
        ],
        "tests": {
          "frameworks": [
            "xunit",
            "nunit",
            "mstest",
            "tunit"
          ],
          "helperMinConfidence": "high",
          "stripTestsSegment": true,
          "targetSuffix": ".Tests"
        },
        "verify": "end"
      },
      "newtonsoft": {
        "hermetic": {
          "nonHermetic": []
        },
        "onDiff": "keep",
        "samples": null,
        "scope": "deployed",
        "target": "[13.0,14.0)",
        "tests": {
          "command": null,
          "entryDepth": 4,
          "folder": "NewtonsoftCharacterization",
          "objectDepth": 3,
          "projects": {},
          "runs": 2,
          "samplesPerType": 3,
          "timeoutSeconds": 1800
        },
        "upgrade": {
          "floor": "13.0.1"
        }
      },
      "paths": {
        "exclude": [],
        "state": ".offramp"
      },
      "projectMap": [],
      "projects": [],
      "report": {
        "ledger": ".offramp/ledger",
        "title": null
      },
      "rules": {
        "packs": {
          "disable": []
        }
      },
      "scan": {
        "builder": "dotnet",
        "msbuildPath": null
      },
      "seams": {
        "hostFramework": "auto",
        "unportableSources": [
          "audit"
        ],
        "unportableSymbols": []
      },
      "service": {
        "dockerfile": true,
        "healthEndpoint": true,
        "host": "linux",
        "k8s": false,
        "logging": "json-console"
      },
      "solution": null,
      "target": 10,
      "verify": {
        "command": null,
        "configuration": "Debug",
        "mode": "build",
        "noWarn": [],
        "onFailure": "rollback",
        "projects": {
          "exclude": [],
          "include": []
        },
        "properties": {},
        "restore": true,
        "timeoutSeconds": 1800,
        "warnAsError": []
      },
      "version": 1
    }
  },
  "result": {
    "answer": 42,
    "items": [
      "a",
      "b"
    ]
  },
  "diagnostics": [
    {
      "code": "OFR0015",
      "severity": "info",
      "message": "Not inside a git work tree; moves would use plain file moves.",
      "project": null,
      "file": null,
      "line": null,
      "column": null,
      "data": {},
      "help": "https://offramp.dev/diagnostics/OFR0015",
      "overridden": true
    },
    {
      "code": "OFR0050",
      "severity": "warning",
      "message": "Unknown key 'verfy' is ignored. Did you mean 'verify'?",
      "project": null,
      "file": "offramp.yml",
      "line": 2,
      "column": 1,
      "data": {
        "key": "verfy"
      },
      "help": "https://offramp.dev/diagnostics/OFR0050"
    }
  ],
  "summary": {
    "errors": 0,
    "warnings": 1,
    "info": 1
  }
}
