{
  "$schema": "https://offramp.dev/schemas/v1/envelope.json",
  "offramp": {
    "version": "{Version}",
    "command": "doctor",
    "target": "net10.0",
    "repositoryRoot": "{RepositoryRoot}",
    "solution": null,
    "workspaceHash": null,
    "startedAt": "{StartedAt}",
    "durationMs": 0,
    "effectiveConfig": {
      "deadCode": {
        "externalConsumers": []
      },
      "deps": {
        "cpm": {
          "file": "Directory.Packages.props",
          "scope": "solution"
        },
        "families": [],
        "feeds": null,
        "ignore": [],
        "includePrerelease": false,
        "packageMap": [],
        "pins": [],
        "preferNewest": false,
        "redirects": {
          "manage": []
        }
      },
      "ide": {
        "implicitCounterparts": true,
        "newCode": {
          "base": "auto",
          "scope": "lines"
        }
      },
      "llm": {
        "apiKeyEnv": "OFFRAMP_LLM_API_KEY",
        "enabled": false,
        "model": null,
        "provider": "openai",
        "url": "http://localhost:1234/v1",
        "uses": [
          "naming",
          "ranking"
        ]
      },
      "move": {
        "coMove": "closure",
        "namespaceMismatch": "allow",
        "suppressAnalyzers": [
          "IDE0130"
        ],
        "tests": {
          "frameworks": [
            "xunit",
            "nunit",
            "mstest",
            "tunit"
          ],
          "helperMinConfidence": "high",
          "stripTestsSegment": true,
          "targetSuffix": ".Tests"
        },
        "verify": "end"
      },
      "newtonsoft": {
        "hermetic": {
          "nonHermetic": []
        },
        "samples": null,
        "target": "[13.0,14.0)",
        "tests": {
          "entryDepth": 4,
          "folder": "NewtonsoftCharacterization",
          "objectDepth": 3,
          "projects": {},
          "samplesPerType": 3
        }
      },
      "paths": {
        "exclude": [],
        "state": ".offramp"
      },
      "projectMap": [],
      "projects": [],
      "report": {
        "ledger": ".offramp/ledger",
        "title": null
      },
      "rules": {
        "packs": {
          "disable": []
        }
      },
      "scan": {
        "builder": "dotnet",
        "msbuildPath": null
      },
      "seams": {
        "hostFramework": "auto",
        "unportableSources": [
          "audit"
        ],
        "unportableSymbols": []
      },
      "service": {
        "dockerfile": true,
        "healthEndpoint": true,
        "host": "linux",
        "k8s": false,
        "logging": "json-console"
      },
      "solution": null,
      "target": 10,
      "verify": {
        "command": null,
        "configuration": "Debug",
        "mode": "build",
        "noWarn": [],
        "onFailure": "rollback",
        "projects": {
          "exclude": [],
          "include": []
        },
        "properties": {},
        "restore": true,
        "timeoutSeconds": 1800,
        "warnAsError": []
      },
      "version": 1
    }
  },
  "result": {
    "checks": [
      {
        "id": "dotnet-sdk",
        "title": ".NET SDK installed",
        "status": "pass",
        "message": "Installed: 8.0.404, 10.0.100.",
        "remedy": null,
        "codes": []
      },
      {
        "id": "global-json",
        "title": "SDK selection (global.json)",
        "status": "pass",
        "message": "No global.json; dotnet uses the newest SDK, 10.0.100.",
        "remedy": null,
        "codes": []
      },
      {
        "id": "target",
        "title": "SDK can target net10.0",
        "status": "pass",
        "message": "SDK 10.0.100 can build net10.0.",
        "remedy": null,
        "codes": []
      },
      {
        "id": "reference-assemblies",
        "title": ".NET Framework reference assemblies",
        "status": "pass",
        "message": "The reference assemblies for net48 are in the NuGet global packages folder (1.0.3).",
        "remedy": null,
        "codes": []
      },
      {
        "id": "git",
        "title": "git installed",
        "status": "pass",
        "message": "git 2.45.0.",
        "remedy": null,
        "codes": []
      },
      {
        "id": "git-repository",
        "title": "git repository",
        "status": "pass",
        "message": "Repository detected; moves are staged with `git mv`.",
        "remedy": null,
        "codes": []
      },
      {
        "id": "config",
        "title": "offramp.yml",
        "status": "pass",
        "message": "No offramp.yml; built-in defaults are in effect.",
        "remedy": "Run `offramp init` to write one with detected values.",
        "codes": [
          "OFR0016"
        ]
      },
      {
        "id": "workspace",
        "title": "Workspace model",
        "status": "warn",
        "message": ".offramp/workspace.json does not exist yet.",
        "remedy": "Run `offramp scan`.",
        "codes": [
          "OFR0001"
        ]
      },
      {
        "id": "windows-only-build-steps",
        "title": "Windows-only build steps",
        "status": "skip",
        "message": "Skipped: run `offramp scan` to detect them.",
        "remedy": null,
        "codes": []
      },
      {
        "id": "plain-build",
        "title": "Builds without Offramp",
        "status": "pass",
        "message": "A plain `dotnet build` of the solution does what Offramp's build does.",
        "remedy": null,
        "codes": []
      },
      {
        "id": "cpm",
        "title": "Central package management",
        "status": "skip",
        "message": "Skipped: no workspace model or solution to compare against.",
        "remedy": null,
        "codes": []
      }
    ],
    "environment": {
      "sdks": [
        "8.0.404",
        "10.0.100"
      ],
      "selectedSdk": "10.0.100",
      "globalJson": null,
      "git": {
        "version": "2.45.0",
        "repository": true
      },
      "os": "linux-x64",
      "target": "net10.0"
    },
    "summary": {
      "pass": 8,
      "warn": 1,
      "fail": 0,
      "skip": 2
    },
    "fix": null
  },
  "diagnostics": [
    {
      "code": "OFR0001",
      "severity": "warning",
      "message": ".offramp/workspace.json does not exist yet.",
      "project": null,
      "file": null,
      "line": null,
      "column": null,
      "data": {
        "path": ".offramp/workspace.json"
      },
      "help": "https://offramp.dev/diagnostics/OFR0001"
    },
    {
      "code": "OFR0016",
      "severity": "info",
      "message": "No offramp.yml at the repository root; built-in defaults are in effect. Run `offramp init` to create one.",
      "project": null,
      "file": null,
      "line": null,
      "column": null,
      "data": {},
      "help": "https://offramp.dev/diagnostics/OFR0016"
    }
  ],
  "summary": {
    "errors": 0,
    "warnings": 1,
    "info": 1
  }
}
